{
  "contract_version": "spine.schedule-update.v3",
  "command_id": "presentation-edit",
  "actor_subject_id": "subject_agent",
  "item_id": "item-example",
  "target_version": "2",
  "updated_at_utc": "2035-02-01T12:00:01Z",
  "patch": {
    "policy_presentations": [
      {
        "notification_policy_id": "policy-old",
        "selection": {
          "kind": "definition",
          "definition": {
            "notification_rendering_definition_id": "notification_rendering_definition_02f257fab5ae9d05c29ad78672208f2329671a72dbb76fa6773c9623950fa1fe",
            "notification_rendering_definition_revision_id": "notification_rendering_definition_revision_e0ba4b36ee5a68085a16c17068ce0091ef1fc0834da7cd9fbcf7c55302dddc52"
          },
          "authorization": {
            "resolution": "unique_match"
          },
          "effective_selection_keys": [
            "departure",
            "flight",
            "terminal"
          ]
        }
      }
    ]
  },
  "materialization": {
    "mode": "none"
  }
}
